{
  "$schema": "https://json-schema.org/draft/2020-12/schema",
  "$id": "https://quickergrillme.local/schema/answers.schema.json",
  "title": "QuickerGrillMe Answers",
  "type": "object",
  "additionalProperties": false,
  "required": [
    "schemaVersion",
    "questionnaireId",
    "questionnaireVersion",
    "level",
    "round",
    "submittedAt",
    "answers",
    "changedFromRecommendations"
  ],
  "properties": {
    "schemaVersion": { "const": "1.1" },
    "questionnaireId": { "type": "string", "minLength": 1 },
    "questionnaireVersion": { "type": "string", "minLength": 1 },
    "level": { "enum": ["essential", "standard", "deep"] },
    "round": { "enum": [1, 2] },
    "submittedAt": { "type": "string", "format": "date-time" },
    "answers": {
      "type": "object",
      "additionalProperties": { "$ref": "#/$defs/answer" }
    },
    "changedFromRecommendations": {
      "type": "array",
      "items": { "type": "string", "minLength": 1 }
    }
  },
  "$defs": {
    "answerValue": {
      "oneOf": [
        { "type": "string", "minLength": 1 },
        {
          "type": "array",
          "minItems": 1,
          "items": { "type": "string", "minLength": 1 }
        }
      ]
    },
    "answer": {
      "type": "object",
      "additionalProperties": false,
      "required": ["questionId", "status", "value", "source"],
      "properties": {
        "questionId": { "type": "string", "minLength": 1 },
        "status": { "enum": ["answered", "deferred"] },
        "value": { "$ref": "#/$defs/answerValue" },
        "source": {
          "enum": ["recommended", "changed", "custom", "deferred"]
        },
        "temporaryDefault": { "$ref": "#/$defs/answerValue" },
        "validationTrigger": { "type": "string", "minLength": 1 }
      }
    }
  }
}
