{
  "schemaVersion": "1.1",
  "questionnaireId": "global-feature-flag-platform",
  "questionnaireVersion": "1.0.0",
  "level": "deep",
  "round": 1,
  "submittedAt": "2026-07-28T02:37:37.798Z",
  "answers": {
    "availability-objective": {
      "questionId": "availability-objective",
      "status": "answered",
      "value": "serve-stale",
      "source": "recommended"
    },
    "evaluation-location": {
      "questionId": "evaluation-location",
      "status": "answered",
      "value": "in-process-sdk",
      "source": "recommended"
    },
    "consistency-model": {
      "questionId": "consistency-model",
      "status": "answered",
      "value": "tiered",
      "source": "recommended"
    },
    "distribution-topology": {
      "questionId": "distribution-topology",
      "status": "answered",
      "value": "regional-stream-plus-poll",
      "source": "recommended"
    },
    "control-plane-writes": {
      "questionId": "control-plane-writes",
      "status": "answered",
      "value": "single-writer-home",
      "source": "recommended"
    },
    "rollout-safety": {
      "questionId": "rollout-safety",
      "status": "answered",
      "value": [
        "progressive-rollout",
        "automatic-rollback",
        "approval"
      ],
      "source": "recommended"
    },
    "flag-lifecycle": {
      "questionId": "flag-lifecycle",
      "status": "answered",
      "value": "owner-expiry-enforced",
      "source": "recommended"
    },
    "targeting-data": {
      "questionId": "targeting-data",
      "status": "answered",
      "value": "typed-context-local",
      "source": "recommended"
    },
    "snapshot-integrity": {
      "questionId": "snapshot-integrity",
      "status": "answered",
      "value": [
        "signature",
        "monotonic-version",
        "schema-validation"
      ],
      "source": "recommended"
    },
    "telemetry-boundary": {
      "questionId": "telemetry-boundary",
      "status": "answered",
      "value": "aggregated-sampled",
      "source": "recommended"
    },
    "experiment-boundary": {
      "questionId": "experiment-boundary",
      "status": "answered",
      "value": "separate-integration",
      "source": "recommended"
    },
    "disaster-recovery": {
      "questionId": "disaster-recovery",
      "status": "answered",
      "value": [
        "immutable-history",
        "signed-rollback",
        "sdk-defaults-only"
      ],
      "source": "recommended"
    },
    "rule-semantics": {
      "questionId": "rule-semantics",
      "status": "answered",
      "value": "versioned-ir-conformance",
      "source": "recommended"
    }
  },
  "changedFromRecommendations": []
}
